{"assessed_at":"2026-10-07T06:34:35.180Z","effective_cleanup_status":"succeeded","effective_leak_audit_status":"clean","effective_lease_status":"released","evidence_integrity":"verified","evidence_refs":[{"artifact_path":"admission/transport-scope-snapshot.json","artifact_sha256":"2adfdc4ab372e4bf500a281491d1ccd9749784a159c48628c1e5ea97d4141926","package_index_sha256":"1a1411b2e6956a6c42179896a6a0fff9a8dc064e93b1845e2b163181cb314f87"},{"artifact_path":"probe/derived/transport-probe-result.json","artifact_sha256":"05ffc0d504fbef148b6156e40ce905466fdb87b70bcb1d04ac72ee75f8d143c1","package_index_sha256":"1a1411b2e6956a6c42179896a6a0fff9a8dc064e93b1845e2b163181cb314f87"},{"artifact_path":"summary/transport-probe-summary.json","artifact_sha256":"89ba5ed1ce0a51bf4f8db7677dd8aa1a266844b5ed1b95bc472d085906f05b7c","package_index_sha256":"1a1411b2e6956a6c42179896a6a0fff9a8dc064e93b1845e2b163181cb314f87"}],"late_evidence_status":"none","original_package_index_sha256":"1a1411b2e6956a6c42179896a6a0fff9a8dc064e93b1845e2b163181cb314f87","package_eligibility":"eligible","probe_usability":"usable","probe_validity":"valid","reasons":[],"record_type":"probe_usability_assessment","safety_status":"within_limits","schema_version":1,"selected_amendment_head_sha256":null,"transport_probe_id":"adfca539-508f-4a51-9a98-e1dcf8cec84a","transport_probe_verdict":"pass","transport_scope_snapshot_sha256":"2adfdc4ab372e4bf500a281491d1ccd9749784a159c48628c1e5ea97d4141926","treatment_fidelity":"verified"}
